{
  "id": "source-player-ryan-luma-chen",
  "slug": "source-player-ryan-luma-chen",
  "continuityId": "kairos-universe",
  "sourceType": "structured-canon-record",
  "title": "Ryan Chen (Luma) canonical record",
  "path": "data/players/ryan-luma-chen.json",
  "locator": null,
  "publicLabel": "Ryan Chen (Luma) canonical record",
  "originType": "fictional",
  "canonStatus": "confirmed",
  "notes": []
}
