{
  "id": "source-player-nolan-dentalplan-hart",
  "slug": "source-player-nolan-dentalplan-hart",
  "continuityId": "kairos-universe",
  "sourceType": "structured-canon-record",
  "title": "Nolan Hart (dentalplan) canonical record",
  "path": "data/players/nolan-dentalplan-hart.json",
  "locator": null,
  "publicLabel": "Nolan Hart (dentalplan) canonical record",
  "originType": "fictional",
  "canonStatus": "confirmed",
  "notes": []
}
