{
  "id": "source-document-league-staff",
  "slug": "source-document-league-staff",
  "continuityId": "kairos-universe",
  "sourceType": "canon-document",
  "title": "League staff canon document",
  "path": "docs/league/LEAGUE_STAFF.md",
  "locator": null,
  "publicLabel": "League staff canon",
  "originType": "fictional",
  "canonStatus": "confirmed",
  "notes": []
}
