{
  "id": "source-player-ethan-vanta-walker",
  "slug": "source-player-ethan-vanta-walker",
  "continuityId": "kairos-universe",
  "sourceType": "structured-canon-record",
  "title": "Ethan Walker player record",
  "path": "data/players/ethan-vanta-walker.json",
  "locator": null,
  "publicLabel": "Ethan \"Vanta\" Walker canonical player record",
  "originType": "fictional",
  "canonStatus": "confirmed",
  "notes": []
}
