{
  "id": "source-player-vincente-flacogomez-galan",
  "slug": "source-player-vincente-flacogomez-galan",
  "continuityId": "kairos-universe",
  "sourceType": "structured-canon-record",
  "title": "Vincente Galán (FLACOGOMEZ) canonical record",
  "path": "data/players/vincente-flacogomez-galan.json",
  "locator": null,
  "publicLabel": "Vincente Galán (FLACOGOMEZ) canonical record",
  "originType": "fictional",
  "canonStatus": "confirmed",
  "notes": []
}
