{
  "id": "source-player-cameron-mold-ruiz",
  "slug": "source-player-cameron-mold-ruiz",
  "continuityId": "kairos-universe",
  "sourceType": "structured-canon-record",
  "title": "Cameron Ruiz (Mold) canonical record",
  "path": "data/players/cameron-mold-ruiz.json",
  "locator": null,
  "publicLabel": "Cameron Ruiz (Mold) canonical record",
  "originType": "fictional",
  "canonStatus": "confirmed",
  "notes": []
}
