{
  "id": "source-player-mason-404-brooks",
  "slug": "source-player-mason-404-brooks",
  "continuityId": "kairos-universe",
  "sourceType": "structured-canon-record",
  "title": "Mason Brooks player record",
  "path": "data/players/mason-404-brooks.json",
  "locator": null,
  "publicLabel": "Mason \"404\" Brooks canonical player record",
  "originType": "fictional",
  "canonStatus": "confirmed",
  "notes": []
}
