{
  "id": "source-player-zayn-parkinglot-haddad",
  "slug": "source-player-zayn-parkinglot-haddad",
  "continuityId": "kairos-universe",
  "sourceType": "structured-canon-record",
  "title": "Zayn Haddad (parkinglot) canonical record",
  "path": "data/players/zayn-parkinglot-haddad.json",
  "locator": null,
  "publicLabel": "Zayn Haddad (parkinglot) canonical record",
  "originType": "fictional",
  "canonStatus": "confirmed",
  "notes": []
}
